[
  {
    "id": "shotgun-leah-2025-11-07-archive-archive-3",
    "owner": "Leah",
    "week": null,
    "date": "2025-11-07",
    "due_date": null,
    "cause": "Archive",
    "completed": true,
    "media_key": "Leah/2025-11-07.mov"
  },
  {
    "id": "shotgun-leah-2026-01-03-archive-archive-4",
    "owner": "Leah",
    "week": null,
    "date": "2026-01-03",
    "due_date": null,
    "cause": "Archive",
    "completed": true,
    "media_key": "Leah/2026-01-03-2.mov"
  },
  {
    "id": "shotgun-leah-2025-09-14-archive-archive-5",
    "owner": "Leah",
    "week": null,
    "date": "2025-09-14",
    "due_date": null,
    "cause": "Archive",
    "completed": true,
    "media_key": "Leah/2025-09-14.mov"
  },
  {
    "id": "shotgun-leah-2025-10-26-archive-archive-6",
    "owner": "Leah",
    "week": null,
    "date": "2025-10-26",
    "due_date": null,
    "cause": "Archive",
    "completed": true,
    "media_key": "Leah/2025-10-26.mov"
  },
  {
    "id": "shotgun-leah-2025-09-07-archive-archive-7",
    "owner": "Leah",
    "week": null,
    "date": "2025-09-07",
    "due_date": null,
    "cause": "Archive",
    "completed": true,
    "media_key": "Leah/2025-09-07.mov"
  },
  {
    "id": "shotgun-leah-2025-10-16-archive-archive-8",
    "owner": "Leah",
    "week": null,
    "date": "2025-10-16",
    "due_date": null,
    "cause": "Archive",
    "completed": true,
    "media_key": "Leah/2025-10-16.mov"
  },
  {
    "id": "shotgun-leah-2025-10-02-archive-archive-9",
    "owner": "Leah",
    "week": null,
    "date": "2025-10-02",
    "due_date": null,
    "cause": "Archive",
    "completed": true,
    "media_key": "Leah/2025-10-02.mov"
  },
  {
    "id": "shotgun-leah-2026-01-03-archive-archive-10",
    "owner": "Leah",
    "week": null,
    "date": "2026-01-03",
    "due_date": null,
    "cause": "Archive",
    "completed": true,
    "media_key": "Leah/2026-01-03.mov"
  },
  {
    "id": "shotgun-mino-2025-12-31-archive-archive-11",
    "owner": "Mino",
    "week": null,
    "date": "2025-12-31",
    "due_date": null,
    "cause": "Archive",
    "completed": true,
    "media_key": "Mino/2025-12-31.mov"
  },
  {
    "id": "shotgun-mino-2025-12-18-archive-archive-12",
    "owner": "Mino",
    "week": null,
    "date": "2025-12-18",
    "due_date": null,
    "cause": "Archive",
    "completed": true,
    "media_key": "Mino/2025-12-18.mov"
  },
  {
    "id": "shotgun-mino-2025-10-30-archive-archive-13",
    "owner": "Mino",
    "week": null,
    "date": "2025-10-30",
    "due_date": null,
    "cause": "Archive",
    "completed": true,
    "media_key": "Mino/2025-10-30.mov"
  },
  {
    "id": "shotgun-mino-2025-12-04-archive-archive-14",
    "owner": "Mino",
    "week": null,
    "date": "2025-12-04",
    "due_date": null,
    "cause": "Archive",
    "completed": true,
    "media_key": "Mino/2025-12-04.mov"
  },
  {
    "id": "shotgun-mino-2026-01-03-archive-archive-15",
    "owner": "Mino",
    "week": null,
    "date": "2026-01-03",
    "due_date": null,
    "cause": "Archive",
    "completed": true,
    "media_key": "Mino/2026-01-03.mov"
  },
  {
    "id": "shotgun-marian-2025-10-02-archive-archive-16",
    "owner": "Marian",
    "week": null,
    "date": "2025-10-02",
    "due_date": null,
    "cause": "Archive",
    "completed": true,
    "media_key": "Marian/2025-10-02-2.mov"
  },
  {
    "id": "shotgun-marian-2025-10-02-archive-archive-17",
    "owner": "Marian",
    "week": null,
    "date": "2025-10-02",
    "due_date": null,
    "cause": "Archive",
    "completed": true,
    "media_key": "Marian/2025-10-02-3.mov"
  },
  {
    "id": "shotgun-marian-2025-10-09-archive-archive-18",
    "owner": "Marian",
    "week": null,
    "date": "2025-10-09",
    "due_date": null,
    "cause": "Archive",
    "completed": true,
    "media_key": "Marian/2025-10-09.mov"
  },
  {
    "id": "shotgun-marian-2025-09-18-archive-archive-19",
    "owner": "Marian",
    "week": null,
    "date": "2025-09-18",
    "due_date": null,
    "cause": "Archive",
    "completed": true,
    "media_key": "Marian/2025-09-18-2.mov"
  },
  {
    "id": "shotgun-marian-2025-10-02-archive-archive-20",
    "owner": "Marian",
    "week": null,
    "date": "2025-10-02",
    "due_date": null,
    "cause": "Archive",
    "completed": true,
    "media_key": "Marian/2025-10-02.mov"
  },
  {
    "id": "shotgun-marian-2025-09-18-archive-archive-21",
    "owner": "Marian",
    "week": null,
    "date": "2025-09-18",
    "due_date": null,
    "cause": "Archive",
    "completed": true,
    "media_key": "Marian/2025-09-18.mov"
  },
  {
    "id": "shotgun-marian-2025-11-20-archive-archive-22",
    "owner": "Marian",
    "week": null,
    "date": "2025-11-20",
    "due_date": null,
    "cause": "Archive",
    "completed": true,
    "media_key": "Marian/2025-11-20.mov"
  },
  {
    "id": "shotgun-dulberger-2026-01-03-archive-archive-23",
    "owner": "Dulberger",
    "week": null,
    "date": "2026-01-03",
    "due_date": null,
    "cause": "Archive",
    "completed": true,
    "media_key": "Dulberger/2026-01-03-2.mov"
  },
  {
    "id": "shotgun-dulberger-2025-09-29-6-carryover-24",
    "owner": "Dulberger",
    "week": 6,
    "date": "2025-09-29",
    "due_date": null,
    "cause": "Carryover",
    "completed": true,
    "media_key": "Dulberger/Carryover-Week6-9-29-2025.mov"
  },
  {
    "id": "shotgun-dulberger-2025-10-09-archive-archive-25",
    "owner": "Dulberger",
    "week": null,
    "date": "2025-10-09",
    "due_date": null,
    "cause": "Archive",
    "completed": true,
    "media_key": "Dulberger/2025-10-09.mov"
  },
  {
    "id": "shotgun-dulberger-2025-12-18-archive-archive-26",
    "owner": "Dulberger",
    "week": null,
    "date": "2025-12-18",
    "due_date": null,
    "cause": "Archive",
    "completed": true,
    "media_key": "Dulberger/2025-12-18.mov"
  },
  {
    "id": "shotgun-dulberger-2025-10-30-archive-archive-27",
    "owner": "Dulberger",
    "week": null,
    "date": "2025-10-30",
    "due_date": null,
    "cause": "Archive",
    "completed": true,
    "media_key": "Dulberger/2025-10-30.mov"
  },
  {
    "id": "shotgun-dulberger-2025-11-27-archive-archive-28",
    "owner": "Dulberger",
    "week": null,
    "date": "2025-11-27",
    "due_date": null,
    "cause": "Archive",
    "completed": true,
    "media_key": "Dulberger/2025-11-27.mov"
  },
  {
    "id": "shotgun-dulberger-2026-01-03-archive-archive-29",
    "owner": "Dulberger",
    "week": null,
    "date": "2026-01-03",
    "due_date": null,
    "cause": "Archive",
    "completed": true,
    "media_key": "Dulberger/2026-01-03.mov"
  },
  {
    "id": "shotgun-malcolm-2025-10-23-archive-archive-30",
    "owner": "Malcolm",
    "week": null,
    "date": "2025-10-23",
    "due_date": null,
    "cause": "Archive",
    "completed": true,
    "media_key": "Malcolm/2025-10-23.mov"
  },
  {
    "id": "shotgun-malcolm-2025-10-09-archive-archive-31",
    "owner": "Malcolm",
    "week": null,
    "date": "2025-10-09",
    "due_date": null,
    "cause": "Archive",
    "completed": true,
    "media_key": "Malcolm/2025-10-09.mov"
  },
  {
    "id": "shotgun-malcolm-2025-12-07-archive-archive-32",
    "owner": "Malcolm",
    "week": null,
    "date": "2025-12-07",
    "due_date": null,
    "cause": "Archive",
    "completed": true,
    "media_key": "Malcolm/2025-12-07.mov"
  },
  {
    "id": "shotgun-erin-2025-10-23-archive-archive-33",
    "owner": "Erin",
    "week": null,
    "date": "2025-10-23",
    "due_date": null,
    "cause": "Archive",
    "completed": true,
    "media_key": "Erin/2025-10-23.mov"
  },
  {
    "id": "shotgun-erin-2025-10-30-archive-archive-34",
    "owner": "Erin",
    "week": null,
    "date": "2025-10-30",
    "due_date": null,
    "cause": "Archive",
    "completed": true,
    "media_key": "Erin/2025-10-30.mov"
  },
  {
    "id": "shotgun-erin-2025-10-16-archive-archive-35",
    "owner": "Erin",
    "week": null,
    "date": "2025-10-16",
    "due_date": null,
    "cause": "Archive",
    "completed": true,
    "media_key": "Erin/2025-10-16.mov"
  },
  {
    "id": "shotgun-erin-2025-09-24-archive-archive-36",
    "owner": "Erin",
    "week": null,
    "date": "2025-09-24",
    "due_date": null,
    "cause": "Archive",
    "completed": true,
    "media_key": "Erin/2025-09-24.mov"
  },
  {
    "id": "shotgun-erin-2025-09-24-archive-archive-37",
    "owner": "Erin",
    "week": null,
    "date": "2025-09-24",
    "due_date": null,
    "cause": "Archive",
    "completed": true,
    "media_key": "Erin/2025-09-24-2.mov"
  },
  {
    "id": "shotgun-erin-img-7068-archive",
    "owner": "Erin",
    "week": null,
    "date": "2025-10-30",
    "due_date": null,
    "cause": "Archive",
    "completed": true,
    "media_key": "Erin/IMG_7068.MOV"
  },
  {
    "id": "shotgun-seth-2025-11-13-archive-archive-38",
    "owner": "Seth",
    "week": null,
    "date": "2025-11-13",
    "due_date": null,
    "cause": "Archive",
    "completed": true,
    "media_key": "Seth/2025-11-13.mov"
  },
  {
    "id": "shotgun-seth-2025-12-11-archive-archive-39",
    "owner": "Seth",
    "week": null,
    "date": "2025-12-11",
    "due_date": null,
    "cause": "Archive",
    "completed": true,
    "media_key": "Seth/2025-12-11-2.mov"
  },
  {
    "id": "shotgun-seth-2025-09-14-archive-archive-40",
    "owner": "Seth",
    "week": null,
    "date": "2025-09-14",
    "due_date": null,
    "cause": "Archive",
    "completed": true,
    "media_key": "Seth/2025-09-14.mov"
  },
  {
    "id": "shotgun-seth-2025-12-18-archive-archive-41",
    "owner": "Seth",
    "week": null,
    "date": "2025-12-18",
    "due_date": null,
    "cause": "Archive",
    "completed": true,
    "media_key": "Seth/2025-12-18.mov"
  },
  {
    "id": "shotgun-seth-2025-10-30-archive-archive-42",
    "owner": "Seth",
    "week": null,
    "date": "2025-10-30",
    "due_date": null,
    "cause": "Archive",
    "completed": true,
    "media_key": "Seth/2025-10-30.mov"
  },
  {
    "id": "shotgun-seth-2025-09-13-archive-archive-43",